nombre,numero,descripcion,url,idioma,topico
Superando o bloqueio criativo,1,Desenvolva temas que lhe permitirão ter mais criatividade. Conheça técnicas para gerar idéias no seu processo criativo.,https://edu.gcfglobal.org//pt/criatividade/,Portugues,criatividade
Todo mundo pode ser criativo,2,A criatividade é uma qualidade que usamos mais do que geralmente acreditamos. Veja como todos nós podemos ser criativos.,https://edu.gcfglobal.org//pt/criatividade/,Portugues,criatividade
O que é arte?,3,A arte tem muitas expressões e não há uma única resposta para defini-la. Saiba mais sobre este tema aqui.,https://edu.gcfglobal.org//pt/criatividade/,Portugues,criatividade
Por que é tão difícil tomar decisões?,4,Tomar decisões não é fácil e pode ser devido a como nossos cérebros são construídos. Vejamos que isso significa.,https://edu.gcfglobal.org//pt/criatividade/,Portugues,criatividade
Perfeccionismo no trabalho,5,"Ser perfeccionista no momento de fazer um projeto, além de nos trazer benefícios, também pode ser contraproducente, afetando nosso processo criativo.",https://edu.gcfglobal.org//pt/criatividade/,Portugues,criatividade
Siga sempre seus impulsos criativos,6,Aprenda a seguir seus impulsos criativos para explorar melhor sua criatividade.,https://edu.gcfglobal.org//pt/criatividade/,Portugues,criatividade
