nombre,numero,descripcion,url,idioma,topico
O que é o Excel 2010 e qual a sua utilidade?,1,Nesta página você aprenderá o que é o Excel 2010 e também verá a sua grande utilidade.,https://edu.gcfglobal.org//pt/microsoft-excel-2010/,Portugues,microsoft-excel-2010
Abrindo o Excel 2010,2,Aqui você aprenderá como abrir o Excel 2010 e também encontrá um vídeo instrutivo de como funciona a interface dos programas do pacote Microsoft Office 2010.,https://edu.gcfglobal.org//pt/microsoft-excel-2010/,Portugues,microsoft-excel-2010
Conheça o ambiente de trabalho do Excel 2010,3,Nesta página você conhecerá o ambiente de trabalho do Excel 2010.,https://edu.gcfglobal.org//pt/microsoft-excel-2010/,Portugues,microsoft-excel-2010
Como criar e salvar um arquivo?,4,"Aqui você verá os passos necessários para criar e salvar uma nova pasta ou arquivo do Excel 2010. 

",https://edu.gcfglobal.org//pt/microsoft-excel-2010/,Portugues,microsoft-excel-2010
Como abrir e fechar um arquivo?,5,"Nesta página você aprenderá a utilizar os comandos que lhe permitirão abrir e fechar arquivos do Excel 2010. 
",https://edu.gcfglobal.org//pt/microsoft-excel-2010/,Portugues,microsoft-excel-2010
Teste de Excel 2010: primeira parte,6,Teste seus conhecimentos sobre a primeira parte do curso de Microsoft Excel 2010.,https://edu.gcfglobal.org//pt/microsoft-excel-2010/,Portugues,microsoft-excel-2010
Como usar as células do Excel 2010?,7,Nesta página você aprenderá como colocar dados nas células do Excel 2010 e quais deles podem ser inseridos nas células.,https://edu.gcfglobal.org//pt/microsoft-excel-2010/,Portugues,microsoft-excel-2010
Como alterar o formato das células?,8,"Nesta página você aprenderá como alterar o formato das células. Por exemplo, o formato das letras, dos números e das datas.
",https://edu.gcfglobal.org//pt/microsoft-excel-2010/,Portugues,microsoft-excel-2010
Como fazer uma adição no Excel 2010?,9,Nesta página você encontrará os passos necessários para fazer uma adição de forma fácil e rápida com o Excel 2010.,https://edu.gcfglobal.org//pt/microsoft-excel-2010/,Portugues,microsoft-excel-2010
Como limpar e excluir uma célula,10,"Nesta página você aprenderá a diferença entre limpar e excluir uma célula. Além disso, aprenderá como proceder em cada um dos casos.",https://edu.gcfglobal.org//pt/microsoft-excel-2010/,Portugues,microsoft-excel-2010
Copiar e colar o conteúdo de uma célula,11,Aqui você aprenderá os comandos para copiar e colar uma célula no Excel 2010.,https://edu.gcfglobal.org//pt/microsoft-excel-2010/,Portugues,microsoft-excel-2010
Como arrastar e soltar células?,12,"Nesta página você aprenderá a reorganizar os dados contidos em uma planilha ao arrastar e soltar células.
",https://edu.gcfglobal.org//pt/microsoft-excel-2010/,Portugues,microsoft-excel-2010
Alterar a largura das células,13,Nesta página você aprenderá a alterar a largura das colunas manualmente ou usando o comando ajustar tamanho de coluna.,https://edu.gcfglobal.org//pt/microsoft-excel-2010/,Portugues,microsoft-excel-2010
Alterar a altura das linhas,14,"Nesta página você aprenderá a alterar a altura das linhas manualmente ou com o comando Ajustar altura de linha. 
",https://edu.gcfglobal.org//pt/microsoft-excel-2010/,Portugues,microsoft-excel-2010
Inserir linhas e colunas,15,"Aqui você encontrará os passos para inserir linhas e colunas em uma planilha. Além disso, poderá conhecer quais opções para inserir estão disponíveis.",https://edu.gcfglobal.org//pt/microsoft-excel-2010/,Portugues,microsoft-excel-2010
"Excluir, quebrar texto e mesclar células",16,"Nesta página você aprenderá a excluir linhas e colunas do excel 2010. Ainda aqui, veremos como quebrar um texto e, também como mesclar colunas para obter uma de maior tamanho.",https://edu.gcfglobal.org//pt/microsoft-excel-2010/,Portugues,microsoft-excel-2010
Teste de Excel 2010: parte 2,17,Teste seus conhecimentos sobre Excel 2010 respondendo a algumas perguntas.,https://edu.gcfglobal.org//pt/microsoft-excel-2010/,Portugues,microsoft-excel-2010
O que é uma planilha?,18,"Nesta página você aprenderá a reconhecer uma planilha do Excel 2010.
",https://edu.gcfglobal.org//pt/microsoft-excel-2010/,Portugues,microsoft-excel-2010
"Inserir, alterar o nome e excluir planilhas",19,"Nesta página você aprenderá como inserir, alterar o nome e excluir planilhas. 
",https://edu.gcfglobal.org//pt/microsoft-excel-2010/,Portugues,microsoft-excel-2010
Como copiar e mover uma planilha,20,Nesta página você aprenderá a copiar e mover uma planilha.,https://edu.gcfglobal.org//pt/microsoft-excel-2010/,Portugues,microsoft-excel-2010
Mudar a cor e agrupar planilhas,21,Aqui você aprenderá como mudar a cor das guias de uma planilha para destacá-la.,https://edu.gcfglobal.org//pt/microsoft-excel-2010/,Portugues,microsoft-excel-2010
Congelar e descongelar linhas e colunas,22,"Nesta página você aprenderá como congelar linhas e colunas, também verá os passos necessários para descongelá-las. 
",https://edu.gcfglobal.org//pt/microsoft-excel-2010/,Portugues,microsoft-excel-2010
Teste de Excel 2010: parte 3,23,Teste os conhecimentos adquiridos na última seção do curso de Excel 2010.,https://edu.gcfglobal.org//pt/microsoft-excel-2010/,Portugues,microsoft-excel-2010
O que é e como criar uma fórmula simples ?,24,Nesta página vamos aprender o que é uma fórmula simples. Este é o primeiro passo para entender bem os cálculos realizados no Excel.,https://edu.gcfglobal.org//pt/microsoft-excel-2010/,Portugues,microsoft-excel-2010
Fórmulas com referências de célula,25,"Nesta página você aprenderá a fazer uma fórmula com referência de célula no Excel 2010.

",https://edu.gcfglobal.org//pt/microsoft-excel-2010/,Portugues,microsoft-excel-2010
Criar fórmulas clicando nas células,26,"Nesta página você aprenderá como fazer uma fórmula simples, fácil e de modo rápido clicando nas células. 
",https://edu.gcfglobal.org//pt/microsoft-excel-2010/,Portugues,microsoft-excel-2010
Modificar fórmulas simples,27,Nesta página você aprenderá como modificar fórmulas simples.,https://edu.gcfglobal.org//pt/microsoft-excel-2010/,Portugues,microsoft-excel-2010
Como calcular uma fórmula composta,28,"Nesta página você aprenderá calcular uma fórmula composta.
",https://edu.gcfglobal.org//pt/microsoft-excel-2010/,Portugues,microsoft-excel-2010
Criando fórmulas com referências relativas,29,Nesta página você aprenderá como fazer fórmulas com referências relativas. Desta maneira poderá poupar o seu tempo fazendo ao mesmo tempo um cálculo em várias colunas ou linhas.,https://edu.gcfglobal.org//pt/microsoft-excel-2010/,Portugues,microsoft-excel-2010
Criar fórmulas com referências absolutas,30,"Nesta página você aprenderá o que é e, como usar fórmulas com referências absolutas. 
",https://edu.gcfglobal.org//pt/microsoft-excel-2010/,Portugues,microsoft-excel-2010
Teste de Excel 2010: parte 4,31,Teste os conhecimentos adquiridos na última seção do curso de Excel 2010.,https://edu.gcfglobal.org//pt/microsoft-excel-2010/,Portugues,microsoft-excel-2010
O que é uma função do Excel?,32,"Nesta página você aprenderá o que é uma função do Excel. Também veremos como trabalhar com alguns argumentos básicos. 
",https://edu.gcfglobal.org//pt/microsoft-excel-2010/,Portugues,microsoft-excel-2010
Como criar uma função básica,33,Nesta página você aprenderá a criar funções básicas no excel 2010.,https://edu.gcfglobal.org//pt/microsoft-excel-2010/,Portugues,microsoft-excel-2010
Biblioteca de funções,34,Nesta página você verá o que é uma biblioteca de funções e como usalá-la.,https://edu.gcfglobal.org//pt/microsoft-excel-2010/,Portugues,microsoft-excel-2010
Usando a Biblioteca de funções,35,"Nesta página você aprenderá a usar a biblioteca de funções.
",https://edu.gcfglobal.org//pt/microsoft-excel-2010/,Portugues,microsoft-excel-2010
Comando Inserir Função,36,"Nesta página você aprenderá como usar o comando inserir função. Desta maneira, poderá encontrar as funções necessárias para seu trabalho apenas informando sua descrição.",https://edu.gcfglobal.org//pt/microsoft-excel-2010/,Portugues,microsoft-excel-2010
Teste de Excel 2010: parte 5,37,"Teste os conhecimentos adquiridos na última seção do curso de Excel 2010.
",https://edu.gcfglobal.org//pt/microsoft-excel-2010/,Portugues,microsoft-excel-2010
Classificação de dados em ordem alfabética,38,Nesta página você aprenderá como fazer uma classificação básica de dados no Excel 2010 e como organizar suas informações em ordem alfabética.,https://edu.gcfglobal.org//pt/microsoft-excel-2010/,Portugues,microsoft-excel-2010
"Classificar os dados por número, hora ou data",39,"Nesta página você aprenderá como classificar os dados de sua planilha numéricamente. 
",https://edu.gcfglobal.org//pt/microsoft-excel-2010/,Portugues,microsoft-excel-2010
Classificar os datos usando critérios personalizados,40,Nesta página você aprenderá a classificar os dados de sua planilha usando seus próprios critérios.,https://edu.gcfglobal.org//pt/microsoft-excel-2010/,Portugues,microsoft-excel-2010
"Classificar por cor de célula, fonte ou ícone",41,"Passos para classificar seus dados por cor de fonte, por cor de célula, fonte oi ícone.",https://edu.gcfglobal.org//pt/microsoft-excel-2010/,Portugues,microsoft-excel-2010
Classificar dados usando vários níveis,42,"Nesta página você aprenderá a organizar dados usando múltiplos níveis. 
",https://edu.gcfglobal.org//pt/microsoft-excel-2010/,Portugues,microsoft-excel-2010
Agrupar os dados de uma planilha,43,"Nesta página você aprenderá a agrupar dados usando o comando Subtotal.
",https://edu.gcfglobal.org//pt/microsoft-excel-2010/,Portugues,microsoft-excel-2010
Mostrar ou ocultar dados,44,"Nesta página você aprenderá a ocultar e mostrar um grupo de dados. 
",https://edu.gcfglobal.org//pt/microsoft-excel-2010/,Portugues,microsoft-excel-2010
Grupos por níveis,45,Nesta página você aprenderá a ver os grupos por níveis.,https://edu.gcfglobal.org//pt/microsoft-excel-2010/,Portugues,microsoft-excel-2010
Desagrupar dados e eliminar Subtotais?,46,"Nesta página você aprenderá a desagrupar dados e eliminar o cálculo de subtotais. 
",https://edu.gcfglobal.org//pt/microsoft-excel-2010/,Portugues,microsoft-excel-2010
Como criar e controlar seus próprios grupos,47,"Nesta página você aprenderá a criar e controlar seu próprio grupo.
",https://edu.gcfglobal.org//pt/microsoft-excel-2010/,Portugues,microsoft-excel-2010
Teste de Excel 2010: parte 6,48,Teste os conhecimentos adquiridos na última seção do curso de Excel 2010.,https://edu.gcfglobal.org//pt/microsoft-excel-2010/,Portugues,microsoft-excel-2010
Filtros do Excel 2010,49,Nesta página você aprenderá sobre os filtros no Excel 2010.,https://edu.gcfglobal.org//pt/microsoft-excel-2010/,Portugues,microsoft-excel-2010
Acrescentar mais de um filtro em sua planilha,50,Nesta página você aprenderá como acrescentar mais de um filtro em sua planilha.,https://edu.gcfglobal.org//pt/microsoft-excel-2010/,Portugues,microsoft-excel-2010
Filtrar usando a opção pesquisar,51,Nesta página você aprenderá como usar filtros usando a opção pesquisar.,https://edu.gcfglobal.org//pt/microsoft-excel-2010/,Portugues,microsoft-excel-2010
Filtros avançados de textos,52,"Nesta página você aprenderá como filtrar os dados de sua planilha por textos. 
",https://edu.gcfglobal.org//pt/microsoft-excel-2010/,Portugues,microsoft-excel-2010
Filtros avançados por data,53,Nesta página você aprenderá como usar filtros avançados por data.,https://edu.gcfglobal.org//pt/microsoft-excel-2010/,Portugues,microsoft-excel-2010
Filtros avançados por números,54,Nesta página você aprenderá a utilizar filtros avançados por números.,https://edu.gcfglobal.org//pt/microsoft-excel-2010/,Portugues,microsoft-excel-2010
Como apagar um filtro,55,Nesta página você aprenderá como apagar um filtro da sua planilha.,https://edu.gcfglobal.org//pt/microsoft-excel-2010/,Portugues,microsoft-excel-2010
Teste de Excel 2010: parte 7,56,Teste os conhecimentos adquiridos na última seção do curso de Excel 2010.,https://edu.gcfglobal.org//pt/microsoft-excel-2010/,Portugues,microsoft-excel-2010
Configurando tabelas,57,Nesta página você aprenderá como configurar tabelas.,https://edu.gcfglobal.org//pt/microsoft-excel-2010/,Portugues,microsoft-excel-2010
Alterar tabelas – Agregar linhas e colunas,58,Nesta página você aprenderá a alterar tabelas e a agregar linhas e colunas.,https://edu.gcfglobal.org//pt/microsoft-excel-2010/,Portugues,microsoft-excel-2010
Como alterar o estilo e as opções da tabela,59,Nesta página você aprenderá a alterar o estilo da tabela.,https://edu.gcfglobal.org//pt/microsoft-excel-2010/,Portugues,microsoft-excel-2010
Teste de Excel 2010: parte 8,60,Teste os conhecimentos adquiridos na última seção do curso de Excel 2010.,https://edu.gcfglobal.org//pt/microsoft-excel-2010/,Portugues,microsoft-excel-2010
Trabalhando com gráficos,61,Nesta página você conhecerá os diferentes tipos de gráficos que o Excel oferece para organizar informações.,https://edu.gcfglobal.org//pt/microsoft-excel-2010/,Portugues,microsoft-excel-2010
Como identificar as partes de um gráfico,62,Nesta página você aprenderá a identificar as partes de um gráfico.,https://edu.gcfglobal.org//pt/microsoft-excel-2010/,Portugues,microsoft-excel-2010
Crie seus próprios gráficos,63,Nesta página você aprenderá a criar os seus próprios gráficos.,https://edu.gcfglobal.org//pt/microsoft-excel-2010/,Portugues,microsoft-excel-2010
As ferramentas dos gráficos,64,Nesta página você aprenderá a identificar as ferramentas dos gráficos,https://edu.gcfglobal.org//pt/microsoft-excel-2010/,Portugues,microsoft-excel-2010
Alterar a ordem dos dados e da apresentação,65,"Nesta página você aprenderá a alterar os dados e a apresentação dos gráficos.  
",https://edu.gcfglobal.org//pt/microsoft-excel-2010/,Portugues,microsoft-excel-2010
Alterar o estilo do gráfico,66,Nesta página você aprenderá a alterar o estilo do gráfico.,https://edu.gcfglobal.org//pt/microsoft-excel-2010/,Portugues,microsoft-excel-2010
Teste de Excel 2010: parte 9,67,Teste os conhecimentos adquiridos na última seção do curso de Excel 2010.,https://edu.gcfglobal.org//pt/microsoft-excel-2010/,Portugues,microsoft-excel-2010
O que é uma formatação condicional?,68,"Nesta página você aprenderá a criar regras para criar formatações condicionais.
",https://edu.gcfglobal.org//pt/microsoft-excel-2010/,Portugues,microsoft-excel-2010
Formatação condicional predeterminada,69,"Nesta página você aprenderá como aplicar formatações condicionais predeterminadas aos dados da sua planilha. 
",https://edu.gcfglobal.org//pt/microsoft-excel-2010/,Portugues,microsoft-excel-2010
Excluir as regras de formatação condicional,70,Nesta página você aprenderá como retirar as regras de formatação condicional aplicadas aos dados de sua planilha.,https://edu.gcfglobal.org//pt/microsoft-excel-2010/,Portugues,microsoft-excel-2010
Teste de Excel 2010: parte 10,71,Teste os conhecimentos adquiridos na última seção do curso de Excel 2010.,https://edu.gcfglobal.org//pt/microsoft-excel-2010/,Portugues,microsoft-excel-2010
O que é e como criar uma tabela dinâmica?,72,Nesta página você aprenderá o que é e como criar uma tabela dinâmica.,https://edu.gcfglobal.org//pt/microsoft-excel-2010/,Portugues,microsoft-excel-2010
Adicionar campos a uma tabela dinâmica,73,Nesta página você aprenderá como adicionar campos a uma tabela dinâmica.,https://edu.gcfglobal.org//pt/microsoft-excel-2010/,Portugues,microsoft-excel-2010
Como alterar os dados na tabela dinâmica,74,Nesta página você aprenderá a trabalhar com dados nas tabelas dinâmicas.,https://edu.gcfglobal.org//pt/microsoft-excel-2010/,Portugues,microsoft-excel-2010
Incluir rótulos de coluna a uma tabela,75,Nesta página você aprenderá a incluir rótulos de coluna em uma tabela dinâmica.,https://edu.gcfglobal.org//pt/microsoft-excel-2010/,Portugues,microsoft-excel-2010
O que é uma segmentação de dados?,76,Nesta página você aprenderá o que é e como funciona a segmentação de dados no excel 2010.,https://edu.gcfglobal.org//pt/microsoft-excel-2010/,Portugues,microsoft-excel-2010
Como usar a segmentação de dados?,77,"Nesta página você aprenderá como usar a segmentação de dados. 
",https://edu.gcfglobal.org//pt/microsoft-excel-2010/,Portugues,microsoft-excel-2010
O que são e como criar gráficos dinâmicos?,78,Nesta página você aprenderá o que são e como criar gráficos dinâmicos.,https://edu.gcfglobal.org//pt/microsoft-excel-2010/,Portugues,microsoft-excel-2010
Teste de Excel 2010: parte 11,79,Teste os conhecimentos adquiridos na última seção do curso de Excel 2010.,https://edu.gcfglobal.org//pt/microsoft-excel-2010/,Portugues,microsoft-excel-2010
Para que serve um teste de hipóteses?,80,Nesta página você verá para que serve um teste de hipóteses no Excel 2010.,https://edu.gcfglobal.org//pt/microsoft-excel-2010/,Portugues,microsoft-excel-2010
A ferramenta atingir meta,81,"Nesta página você aprendera a usar a ferramenta atingir metas. Com ela, será possível saber qual é taxa máxima de juros que você pagará em seu empréstito.",https://edu.gcfglobal.org//pt/microsoft-excel-2010/,Portugues,microsoft-excel-2010
Ferramentas de análise Gerenciador de cenários,82,Nesta página você aprenderá para que serve e como usar a ferramenta de análise Gerenciador de cenários do Excel 2010.,https://edu.gcfglobal.org//pt/microsoft-excel-2010/,Portugues,microsoft-excel-2010
Teste de Excel 2010: parte 12,83,Teste os conhecimentos adquiridos na última seção do curso de Excel 2010.,https://edu.gcfglobal.org//pt/microsoft-excel-2010/,Portugues,microsoft-excel-2010
Teste Final Excel 2010,84,Teste os conhecimentos adquiridos no curso de Excel 2010.,https://edu.gcfglobal.org//pt/microsoft-excel-2010/,Portugues,microsoft-excel-2010
